{
  "description": "An integral float is accepted and encoded without a fractional part.",
  "kind": "encode",
  "event": {
    "ts": "2026-08-01T12:00:00.000Z",
    "level": "info",
    "extensionId": "acme-gcal",
    "event": "sync.page",
    "fields": {
      "ms": 118
    }
  },
  "expect": {
    "ok": true,
    "line": "{\"nimbus\":\"diag\",\"ts\":\"2026-08-01T12:00:00.000Z\",\"level\":\"info\",\"extensionId\":\"acme-gcal\",\"event\":\"sync.page\",\"fields\":{\"ms\":118}}"
  }
}
