{
  "description": "A non-ASCII extensionId is emitted literally, not escaped.",
  "kind": "encode",
  "event": {
    "ts": "2026-08-01T12:00:00.000Z",
    "level": "info",
    "extensionId": "acmé",
    "event": "sync.page"
  },
  "expect": {
    "ok": true,
    "line": "{\"nimbus\":\"diag\",\"ts\":\"2026-08-01T12:00:00.000Z\",\"level\":\"info\",\"extensionId\":\"acmé\",\"event\":\"sync.page\"}"
  }
}
