{
  "description": "Sixteen fields is at the limit and accepted.",
  "kind": "encode",
  "event": {
    "ts": "2026-08-01T12:00:00.000Z",
    "level": "info",
    "extensionId": "acme-gcal",
    "event": "sync.page",
    "fields": {
      "k0": 0,
      "k1": 1,
      "k2": 2,
      "k3": 3,
      "k4": 4,
      "k5": 5,
      "k6": 6,
      "k7": 7,
      "k8": 8,
      "k9": 9,
      "k10": 10,
      "k11": 11,
      "k12": 12,
      "k13": 13,
      "k14": 14,
      "k15": 15
    }
  },
  "expect": {
    "ok": true,
    "line": "{\"nimbus\":\"diag\",\"ts\":\"2026-08-01T12:00:00.000Z\",\"level\":\"info\",\"extensionId\":\"acme-gcal\",\"event\":\"sync.page\",\"fields\":{\"k0\":0,\"k1\":1,\"k10\":10,\"k11\":11,\"k12\":12,\"k13\":13,\"k14\":14,\"k15\":15,\"k2\":2,\"k3\":3,\"k4\":4,\"k5\":5,\"k6\":6,\"k7\":7,\"k8\":8,\"k9\":9}}"
  }
}
